{
  "schema_version": 1,
  "protocol_version": 1,
  "deployment_id": "dpl_fixture01",
  "server_version": "0.5.0",
  "public_key": "AAAAAAAAAAAAAAAAAAAAAAAAAAAAAAAAAAAAAAAAAAA",
  "public_key_sha256": "66687aadf862bd776c8fc18b8e9f8e20089714856ee233b3902a591d0d5f2925",
  "challenge": "fixture_challenge_1234",
  "signature": "AAAAAAAAAAAAAAAAAAAAAAAAAAAAAAAAAAAAAAAAAAAAAAAAAAAAAAAAAAAAAAAAAAAAAAAAAAAAAAAAAAAAAA",
  "capabilities": ["project_connections_v1"],
  "capabilities_signature": "AAAAAAAAAAAAAAAAAAAAAAAAAAAAAAAAAAAAAAAAAAAAAAAAAAAAAAAAAAAAAAAAAAAAAAAAAAAAAAAAAAAAAA"
}
